{
  "schemaVersion": 1,
  "status": "verified",
  "receiptId": "fleet-page-bbbbbbbbbbbbbbbbbbbb",
  "postContentHash": "5f1b77cb8e704fdd30fcbc8fa26a2fbac490bdcaa3d058f1b6f5cecf88899f37",
  "extractedPostContentSha256": "7a51044918fbce29a058c7d1f469dcc1fee1c55a7f05306b841576f87b8b9f60",
  "anonymousResponseSha256": "5f1b77cb8e704fdd30fcbc8fa26a2fbac490bdcaa3d058f1b6f5cecf88899f37",
  "anonymousContentLength": 2726,
  "extractionStart": "<!-- BM-FLEET-PAGE:START -->",
  "extractionEnd": "<!-- BM-FLEET-PAGE:END -->",
  "contentHash": "cccccccccccccccccccccccccccccccccccccccccccccccccccccccccccccccc",
  "verificationHash": "bbbbbbbbbbbbbbbbbbbbbbbbbbbbbbbbbbbbbbbbbbbbbbbbbbbbbbbbbbbbbbbb",
  "sourceRevision": "0123456789abcdef0123456789abcdef01234567",
  "sourceManifestSha256": "fbdce9e272429c583cbb81f884a50d8bedb1400c67ef67ace637b94f0e06722b",
  "model": "GPT-5",
  "humanReviewer": "Dennis Yu",
  "humanReviewerRole": "human",
  "runId": "fleet-public-run-100",
  "configuredCount": 53,
  "publicDefinitionCount": 31,
  "itemListCount": 31,
  "linkContentHash": "cccccccccccccccccccccccccccccccccccccccccccccccccccccccccccccccc",
  "linkReceiptId": "link-run-123",
  "liveUrl": "https://blitzmetrics.com/scheduled-jobs-fleet/",
  "finalAnonymousReadback": true,
  "browserVisibilityVerified": true,
  "browserCheckedAt": "2026-08-31T20:08:00-05:00",
  "browserCheckedBy": "agent:codex-browser-verifier",
  "browserRunReceiptId": "browser-run-123",
  "httpStatus": 200,
  "cacheBuster": "fleet-receipt-bbbbbbbbbbbbbbbbbbbb",
  "checkedAt": "2026-08-31T20:10:00-05:00",
  "checkedBy": "agent:codex-lss-verifier",
  "wordpressRevision": "wp:110278:113449",
  "articleSchemaCount": 1,
  "articleDateModified": "2026-08-31T20:05:00-05:00",
  "wordpressModifiedAt": "2026-08-31T20:05:00-05:00"
}
